Company Name,Title,Role,Role url,Localisation,Type,Level,Description,Country,Region,City
CareerAddict,Machine Learning Research Engineer,Machine Learning,https://www.linkedin.com/jobs/view/3426702270/?alternateChannel=search&refId=tkF9mApbIRxnKWft2AsIFQ%3D%3D&trackingId=CAOga3nkylnhnJFKcgRjCQ%3D%3D&trk=d_flagship3_search_srp_jobs,"Londyn, Anglia, Wielka Brytania",Pelny etat,Poczatkujacy,"We are seeking a dynamic and experienced Machine Learning Engineer with expertise in Machine Learning and/or Computer Vision, including 2D and 3D.

Our client is best known for developments in material capture. they have designed and patented a method that allows for the accurate and automatic conversion of real-world materials into a proprietary 3D format. The method has gained interest from leaders in game, film, VFX, and fashion industries.

As a Machine Learning Engineer, you will be responsible for developing, testing and deploying machine learning models and algorithms.

You will be expected to have a good understanding of various machine learning techniques, such as supervised and unsupervised learning, deep learning, and reinforcement learning. You will also need to have experience with computer vision, including 2D and 3D techniques with experience with tools such as Blender.

The ideal candidate should have a strong academic background in a relevant field, such as computer science, mathematics, or engineering.

Requirements

Knowledge of Python and a common ML framework (Tensorflow preferred)
Strong in maths and statistics
Experienced in version control (eg git)
Able to write production-ready code
Able to extract techniques and methods from academic research and apply them in practice
Ability to work independently and take ownership of tasks
Think creatively about technical problems

You should also have a proven track record of developing and deploying successful machine learning models and algorithms.

If you are interested in this opportunity, please send us your CV and a cover letter outlining your experience and qualifications. We look forward to hearing from you!",Wielka Brytania,Anglia,Londyn
CGG,Machine Learning Engineer/ Researcher - 2022 Programme,Machine Learning,https://www.linkedin.com/jobs/view/3404247152/?alternateChannel=search&refId=tkF9mApbIRxnKWft2AsIFQ%3D%3D&trackingId=5%2BUpS3KzlFLSt9PjiHuqDg%3D%3D&trk=d_flagship3_search_srp_jobs,"Crawley, Anglia, Wielka Brytania",Pelny etat,Poczatkujacy,"Company Description

CGG (www.cgg.com) is a global geoscience technology leader. Employing around 3,700 people worldwide, CGG provides a comprehensive range of data, products, services and solutions that support our clients to achieve their business and transition goals. We combine human ingenuity and new technology to understand and solve the world’s natural resource, environmental and infrastructure challenges.

Job Description

Become Part of our Team

We are looking for experienced and talented individuals to join our largest European centre, based in South-East England, operating across a diverse global market with high profile international customers.

As a Machine Learning engineer, you’ll play a vital role in the continual development of our geoscience analytic techniques. You will work closely with researchers, the software development group and the scientists in our geoscience teams to implement machine learning and deep learning solutions.

You will be working with our geoscientists to validate the potential opportunities for machine learning techniques, prepare data for training and testing, designing the model, training the model and deploying in production. As an integral member of our team, we highly encourage the contribution of ideas and drive in the generation of new concepts, to maintain our outstanding leadership position for technology and service delivery in the market place.

Qualifications

You are likely to be educated to a PHD degree level in any of the following disciplines but a combination of education and experience will be considered; Computer Science, Mathematics, Physics or similar.

Key Skills & Competencies

A passion and aptitude for programming, technology and enthusiasm for analytical and problem solving challenges
Strong experience in developing and debugging in Python and preferably at least one of other main languages (C/C++/ java)
Proven experience with deep learning frameworks and usage of DL libraries (TensorFlow/Pytorch)
Proficiency to design, build, test and support innovative solutions
The ability to define and manage project deadlines
The ability to balance workloads across a wide variety of projects
To keep all stakeholders regularly informed on progress
To innovate and have fun through collaboration and generation of ideas which lead to enhancements of our workflows
An enthusiastic attitude towards learning and flexibility to adapt to new challenges or changes in direction

Additional Information

We ask that you submit a CV and Covering Lettering as part of your application.

Learning and Development

Our culture of learning and complementary approach to supported or self-guided career development, enables the design of tailored courses to suit specific needs of each individual to aid personal growth in areas related to technical, commercial and personal skills, via an extensive suite of CGG developed courses, managed through our own CGG University platform.

Benefits Package

Competative starting salary.
Highly attractive bonus scheme
Initially 22 days holiday with future increases, complemented by a flexible buying and selling holiday program
Company contributory pension plan
Accommodation assistance program
Flexible Private Medical & Dental care programs, tailored to suit individual or family needs
Employee Assistance Program to support our staff

We Care About Our Staff And Environment

We recognise the importance of work life balance for our employees, which is supported through our flexible working and relaxed dress code policies.

We recognise and actively support the wellbeing of our staff through many different initiatives;

Onsite exercise classes and promoting active lifestyles
Our restaurant, offering great food and a highly effective social and work space
Regular social club events, spontaneous reward events throughout the year
Many discounts schemes, including Gym membership and a cycle purchase scheme

We encourage and actively support a strong sense of community, through volunteering and various company initiatives, as well as a strong company commitment to protecting our environment through sustainable solutions, energy saving and waste reduction enterprises.

We see things differently. Diversity fuels our innovation, we value the unique ways in which we differ, and we are committed to equal employment opportunities for all professionals.",Wielka Brytania,Anglia,Crawley
Robert Walters,Machine Learning Engineer,Machine Learning,https://www.linkedin.com/jobs/view/3410454337/?alternateChannel=search&refId=RiBK36zLO1WKxo%2B62qXmGA%3D%3D&trackingId=BQ06XRz5g2jYlpa73WJoUA%3D%3D&trk=d_flagship3_search_srp_jobs,"Londyn, Anglia, Wielka Brytania",Pelny etat,Poczatkujacy,"Machine Learning Engineer needed for a Crypto focussed start up

In this role, you will have the opportunity to work on cutting-edge projects and make a real impact on the future of our company. You will be responsible for developing and implementing machine learning models to improve our crypto currency platform, as well as collaborating with cross-functional teams to drive innovation and achieve business goals.

If you have a strong background in machine learning and are excited about the opportunity to work in the dynamic world of crypto currencies, we encourage you to apply for this role. Don't miss out on this exciting opportunity to join a fast-paced and innovative team at the forefront of the industry.

Qualifications

To be considered for this role as a machine learning engineer at our crypto currency start-up, the following qualifications are required

A bachelor's or master's degree in a related field such as computer science, data science, or machine learning. + at least 3 years com exp.
Strong programming skills, with experience in languages such as Python, R, or Java.
Experience with machine learning frameworks such as TensorFlow, Keras, or PyTorch.
Experience developing and implementing machine learning models for real-world applications.
Strong problem-solving and analytical skills.
Ability to work independently and in a team environment.
Good communication and collaboration skills.
Familiarity with the crypto currency industry is a plus.

Our Client are offering a competitive salary of up to £75,000 for the right candidate, as well as opportunities for professional development and growth within the company.

Robert Walters Operations Limited is an employment business and employment agency and welcomes applications from all candidates",Wielka Brytania,Anglia,Londyn
Coincover,Machine Learning Engineer,Machine Learning,https://www.linkedin.com/jobs/view/3405459347/?alternateChannel=search&refId=RiBK36zLO1WKxo%2B62qXmGA%3D%3D&trackingId=%2FgMXJyLocoVMLWjDuTYWnw%3D%3D&trk=d_flagship3_search_srp_jobs,"Cardiff, Walia, Wielka Brytania",Pelny etat,Poczatkujacy,"Position Overview

As a start up with a first mover advantage, we have had to move very fast. As our data-driven and machine learning products and features reach maturity, we need to solidify their implementation in a highly performant production environment. You will be part of a small and fast-moving team, bridging the gap between the data scientists and the remaining platform engineers, to bring highly performant and optimised machine learning features to production, monitor them, and help scale them with our product. Given the size of the team, you are expected to cover different responsibilities such as data and platform engineering.

Roles And Responsibilities
Design and implement MLOps on AWS that can help solidify the best practices for all stages of machine learning products and features
Machine learning model and other data-driven features review, including refactorise, optimise, containerise, deploy, version, and monitor their quality
Train, validate, and test models prototyped and designed by data scientists
Design and build solutions and tools to help data scientists and analysts access the data to perform their work
In conjugation with the data scientists, collect and curate relevant data and data sources for the machine learning and data science models
Validate and verify data quality and schema assumptions used in production
Bridge the gap between the data scientists and the platform engineers
Actively participate in internal data science and machine learning scientific and best practices reviews and discussions
Take the initiative and leading role in solving the technological challenges arising from machine learning products and features
Take ownership in the production implementation of the machine learning products and features

Requirements
Minimum 5 years of experience as a ML Engineer and/or machine learning engineer
Experience in implementing ML workflows and frameworks
Experience in deploying, optimising, monitoring machine learning models in production
AWS and its services
Terraform/Pulumi
Database skills, with focus on SQL
Containers, such as Docker
Programming languages like Python
Knowledge of machine learning frameworks such as SciKit Learn, Keras, PyTorch, Tensorflow, etc

Desired
MLOps frameworks such as MLflow, Neptune, Aim, etc
Data science frameworks such as Databricks, Snowflake, etc
Data-streams on AWS Kinesis
Domain expertise on fraud detection, financial services, cryptocurrency

This role will be based on a remote basis, however some travel to Cardiff maybe required every few months.",Wielka Brytania,Walia,Cardiff
Extended Family International,Machine Learning Engineer,Machine Learning,https://www.linkedin.com/jobs/view/3393471205/?alternateChannel=search&refId=9aU5qp9N242LF0O6lSuuUA%3D%3D&trackingId=mMj%2B2N0nSiP05ldW2HYRYQ%3D%3D&trk=d_flagship3_search_srp_jobs,"Cambridge, Anglia, Wielka Brytania",Pelny etat,Poczatkujacy,"Ta oferta została pozyskana z tablicy ofert pracy. Więcej informacji
Job Ad

What you will be doing:
Deploying state of the art models, trained on production size data sets
Optimizing GPU systems for training performance
Using data augmentation techniques to improve production model performance
Using a range of inference optimization techniques, such as model distillation, quantization, model pruning
Helping to define and implementing best practice ways of working.
Keeping up to speed with latest research to drive company strategy
The Following Are Advantageous
At least 2 years experience in training machine learning models for production applications
Master's or PhD in related scientific or engineering field with good theoretical understanding of machine learning/deep learning.
Use of machine learning frameworks such as PyTorch or TensorFlow.
Experience in optimizing GPU for training performance
Knowledge of model compression techniques such as reduced precision or model pruning
Experience using C++ or other high performance software language
Attention to detail, good communication and documentation skills.",Wielka Brytania,Anglia,Cambridge
Arden Resourcing Limited,Machine Learning Engineer (C++ Essential)- Remote Within UK Only,Machine Learning,https://www.linkedin.com/jobs/view/3426054035/?alternateChannel=search&refId=9aU5qp9N242LF0O6lSuuUA%3D%3D&trackingId=0V0RbEz45oYFeiQU1TZDOQ%3D%3D&trk=d_flagship3_search_srp_jobs,Wielka Brytania,Pelny etat,Poczatkujacy,"Ta oferta została pozyskana z tablicy ofert pracy. Więcej informacji
Machine Learning Engineer (C++ Essential)- Remote Within UK Only £60,000-£70,000 It’s an exciting time of expansion for my client as they become a leading player in their field. In response to end user demand, they have innovated their platforms which are going from strength to strength. The end users of their system span a variety of interesting sectors and this role represents a great opportunity for someone to join an established team achieving real time growth. About the Role To support this, they are looking for an ambitious Machine Learning Engineer with solid experience in AI. The company will be scaling up extensively and moving towards edge environments using edge AI low power, high performance hardware solutions. Roles Responsibilities-Define and implement an AI solution for image recognition.
Take the role of expert in a small team of bright dedicated developers.
Operate across AI Model development, deployment and integration in both cloud and edge environments
Ensure the solution is cost effective for customers and deliver projects to agreed timescales Knowledge, Skills and Experience Essential
Experience developing image recognition solutions using Convolutional Neural Networks
Ideal experience is with TensorFlow for model development.
Experience with Python
Multithreaded C++/C for edge deployment and integration Desirable
Designing and implementing models in the Cloud, preferably using AWS Sagemaker
Experience with edge based AI hardware such as Google Coral TPU or Hailo device or similar
Linux
API development in Node JS would be a bonus. You will join an environment where the whole team work collaboratively across departments to support each other. The team have a strong proven track record of growing technology start-ups into successful global businesses across a variety of sectors. In joining you will become a key member of this team and will be joining at a stage of their expansion that gives you the opportunity to own and grow your role and influence the future success of the company",Wielka Brytania,,
Arden Resourcing Limited,Machine Learning Engineer (C++ Essential)- Remote Within UK Only,Machine Learning,https://www.linkedin.com/jobs/view/3425208411/?alternateChannel=search&refId=%2BsxcW7cBdS%2FzGvXMQOixHQ%3D%3D&trackingId=EQxc2VBiObQpzONsBLNPZA%3D%3D&trk=d_flagship3_search_srp_jobs,"Londyn, Anglia, Wielka Brytania",Pelny etat,Poczatkujacy,"Ta oferta została pozyskana z tablicy ofert pracy. Więcej informacji
Machine Learning Engineer (C++ Essential)- Remote Within UK Only£60,000-£70,000

It’s an exciting time of expansion for my client as they become a leading player in their field. In response to end user demand, they have innovated their platforms which are going from strength to strength. The end users of their system span a variety of interesting sectors and this role represents a great opportunity for someone to join an established team achieving real time growth.

About The Role

To support this, they are looking for an ambitious Machine Learning Engineer with solid experience in AI. The company will be scaling up extensively and moving towards edge environments using edge AI low power, high performance hardware solutions.

Roles Responsibilities

Define and implement an AI solution for image recognition.
Take the role of expert in a small team of bright dedicated developers.
Operate across AI Model development, deployment and integration in both cloud and edge environments
Ensure the solution is cost effective for customers and deliver projects to agreed timescales

Knowledge, Skills and ExperienceEssential

Experience developing image recognition solutions using Convolutional Neural Networks
Ideal experience is with TensorFlow for model development.
Experience with Python
Multithreaded C++/C for edge deployment and integrationDesirable
Designing and implementing models in the Cloud, preferably using AWS Sagemaker
Experience with edge based AI hardware such as Google Coral TPU or Hailo device or similar
Linux
API development in Node JS would be a bonus.

You will join an environment where the whole team work collaboratively across departments to support each other. The team have a strong proven track record of growing technology start-ups into successful global businesses across a variety of sectors. In joining you will become a key member of this team and will be joining at a stage of their expansion that gives you the opportunity to own and grow your role and influence the future success of the company.",Wielka Brytania,Anglia,Londyn
Metrica Recruitment,Machine Learning Engineer,Machine Learning,https://www.linkedin.com/jobs/view/3423331449/?alternateChannel=search&refId=%2BsxcW7cBdS%2FzGvXMQOixHQ%3D%3D&trackingId=urk8YBJ0PVdKS1LUCcd8GQ%3D%3D&trk=d_flagship3_search_srp_jobs,"Londyn, Anglia, Wielka Brytania",Pelny etat,Poczatkujacy,"The Company

Recently named one of Britain’s fastest growing tech firms, this company are at the forefront of data and technology in the fashion retail space. Using fashion-specific AI, expert knowledge and proprietary data, they are looking to deliver a prediction platform that can offer clients the ability to predict customer behaviours and fashion trends to optimise and personalise shopping journeys.

The Role

With machine learning at the core of what the business is about, they are now looking to hire an exceptional machine learning expert to work closely with their well-established team of Data Scientists and Analysts in implementing state of the art algorithms.

This role offers the chance to work with vast and complex data sets, applying data-mining, graph analysis and machine learning techniques for a variety of customer-centric modelling and reference problems. You would be working with cutting edge machine learning tools with the opportunity to use a multitude of software packages including Python, R, C, C++ and MATLAB.

Essential Skills

A technical degree from a reputable university.
2 years experience as a programmer.
Experience in implementing machine learning algorithms.
Experience using multiple software packages such as Python, R, C, C++ and Java.

Job Owner: d.prosser

Tagged as: C#, Java, Matlab, Python, R, SQL",Wielka Brytania,Anglia,Londyn
