Company Name,Title,Role,Role url,Localisation,Type,Level,Description,Country,Region,City
WayUp,"Adobe, 2023 Intern - Machine Learning Engineer Intern - Application via WayUp",Machine Learning,https://www.linkedin.com/jobs/view/3427549261/?alternateChannel=search&refId=TbNo3TIVVYO8o1%2Fv6Qs73Q%3D%3D&trackingId=kaP2P1mHayhZ4r3obwj8wA%3D%3D&trk=d_flagship3_search_srp_jobs,"Seattle, WA",Pelny etat,Staz,"This role is with Adobe. WayUp is partnering with Adobe to hire top talent.

Our Company Changing the world through digital experiences is what Adobe’s all about. We give everyone—from emerging artists to global brands—everything they need to design and deliver exceptional digital experiences! We’re passionate about empowering people to create appealing and powerful images, videos, and apps, and transform how companies interact with customers across every screen. We’re on a mission to hire the very best and are committed to creating exceptional employee experiences where everyone is respected and has access to equal opportunity. We realize that new insights can come from everywhere in the organization, and we know the next big idea could be yours! Creative Cloud enables customers to create, and includes such well-known products as Photoshop, Illustrator, Lightroom, and Adobe Stock. Machine Learning is a critical part of Adobe’s Creative Cloud offering. Adobe Sensei powers machine learning and artificial intelligence across all Adobe Cloud product lines. It enables thousands of applied researchers, millions of users, and billions of content pieces. The objective is to make machine learning offerings an extraordinary, innovative, differentiating product in Adobe Cloud ecosystem. We match the pace, innovation and excitement of a startup, backed by the resources and infrastructure of Adobe. The Intelligent Services group within Creative Cloud releases the latest Adobe Sensei powered features within flagship products such as Photoshop or Illustrator. Recent popular features such as Neural Filters or Discover Panel have originated and been built by the group. The Opportunity In this role you will be part of an exciting project related to imaging and computer vision. You will work with premier researchers to productize creative technologies to be integrated in applications such as Photoshop. The job requires studying lots of papers and solving problems to make the feature robust and useable in real world applications. All 2023 Adobe Interns will be ‘co-located hybrid’, meaning that you will be assigned to an Adobe office location but in-office schedules will be flexible (2-3 days per week). All interns must live in the same state, country, and within commuting distance of their assigned Adobe office, so they can be on-site as needed. Interns visiting Adobe sites must follow all applicable COVID-19 health and safety protocols. What You’ll Do
Build tools and prototypes to accelerate the integration of ML research into products
Collaborate with a team of Researchers and Engineers to build a working proof of concept for a feature
Write documentation for the tools to be consumed by researchers and engineers
Implement a basic application to showcase the feature What You Need to Succeed
Currently enrolled full time and pursuing a Bachelor's or Master’s degree in Computer Science, Computer Engineering; or equivalent experience required
Coding expertise in Python, Pytorch, and C++
Excellent oral and written communication skills
Familiarity with the latest developments in computer vision and graphics specially in image synthesis domain If you’re looking to make an impact, Adobe’s the place for you. Discover what our employees are saying about their career experiences on the Adobe Life blog and explore the meaningful benefits we offer. Adobe is an equal opportunity employer. We welcome and encourage diversity in the workplace regardless of race, gender, sexual orientation, gender identity, disability or veteran status.",USA,WA,Seattle
Packback,Machine Learning Engineer,Machine Learning,https://www.linkedin.com/jobs/view/3422050865/?alternateChannel=search&refId=T1dYfbvAr98yRyc8LPJ1Cg%3D%3D&trackingId=vhChh8BTqRKCUatKAFm5gw%3D%3D&trk=d_flagship3_search_srp_jobs,"Chicago, IL",Pelny etat,Poczatkujacy,"Packback is looking for a Machine Learning Engineer to support our mission to awaken and fuel the lifelong curiosity in every student. As a Machine Learning Engineer at Packback, you will be building features that empower students and professors to have a better learning experience.

Packback’s A.I.-powered platform is used by educators in K-12 and higher education to help their students fall in love with the subject matter, drive personalized learning, and most importantly, quantify and improve student critical thinking skills.

Key job duties include communicating well, providing thoughtful feedback to teammates, pairing, actively improving our team knowledge-base, and of course, writing code. You’ll be improving our data infrastructure, improving our Python APIs that power Packback’s AI, and developing new machine learning models (and deploying them to users) from Packback’s unique dataset.

Why You Should Work at Packback

Reach - Our platform, Packback Questions, is used by more than 10 thousand educators and 1.5 million students, who collectively author more than 10 million posts a year. You will be a part of building a platform that has a huge impact on inspiring curiosity in students.

Training - We offer opportunities for learning and mentorship. We value people who like to wear many hats. You can get involved with the front end, back end, infrastructure and data functions.

Ownership - Packback is a rapidly growing company. You will have responsibility for bringing innovative features to market while working closely with the product team.

Want to learn more about engineering at Packback? Check out our docs repo on Github.

Requirements

We’re looking for somebody who is excited to work on our backend, infrastructure, and data science codebases. To succeed, you should have experience working with web frameworks (we use Django, but mainly that you are a great developer), have a strong grasp of machine learning fundamentals, and have experience developing production ML systems throughout the entire model lifecycle.

Additionally, We’re Looking For

Hands-on experience throughout the machine learning lifecycle: data transformation, feature engineering, and model deployment
Experience deploying machine learning models to production web applications at scale within a modern web framework (e.g. Django)
A solid understanding of classical statistics, such as fitting regression models, inference testing, and sampling methods
Excellent SQL skills and experience with ETL/ELT data modeling processes
2+ years of software engineering experience, especially with web-based products. However, transferable experience is more important than years of experience.

It's great if you have

Demonstrated experience doing backend web development using a modern web framework such as Django (or some other equivalent MVC framework)
Experience working on highly scalable cloud infrastructures
Comfort with Linux/UNIX systems
Startup or small company experience

Our commitment to diversity

Working in the Education Technology space, it is an ethical necessity for us to build a diverse and inclusive team in order to better consider the needs of our audience’s wide range of backgrounds and educational experiences. We provide regular training on topics of diversity, equity, and inclusion to all employees.

Employees of color are invited to participate in a mentorship program with members of our executive team to build career skills and to help with career progression.

We do not discriminate on the basis of race, religion, color, national origin, gender, sexual orientation, age, marital status, veteran status, or disability status.

Perks of working at Packback

A culture that you can be proud to build: We work hard at building an inclusive culture of curiosity and continuous learning at Packback. In any role at Packback, being a good steward of our values and using them to inform decisions and communication can make an enormous impact on the business.

Work-life balance: Packback offers an unlimited vacation policy. Team members are encouraged to take time off for volunteer opportunities. Our engineering team is fully remote, and provides flexibility and support for working wherever makes the most sense for you.

Competitive Salary and Benefits: The salary range for this position is $85k-130k annually + bonus. We set clear expectations for professional growth and offer an annual learning and development stipend.

Benefits

Health & Wellness

Medical Insurance
Dental Insurance
Vision Insurance
401(k) with a 50% employer match
Stock options
Disability Insurance
Life Insurance
Commuter Benefits
Generous Parental Leave up to 12 weeks
Family Medical Leave
Unlimited Time Off

Additional Perks

Access to premium membership to One Medical
Calm subscription
Monthly Dashpass subscription by DoorDash",USA,IL,Chicago
SynergisticIT,Machine Learning Engineer,Machine Learning,https://www.linkedin.com/jobs/view/3415228996/?alternateChannel=search&refId=4lifrVhvWkbu7GyAhUYmmQ%3D%3D&trackingId=yygI2HnlDrscEy%2BDKDWNkQ%3D%3D&trk=d_flagship3_search_srp_jobs,"Morgan City, LA",Zlecenie,Poczatkujacy,"SynergisticIT is a full service staffing and placement firm servicing client in America for the past 12 years. We are dedicated towards fulfilling the IT needs of our clients. From staffing to full implementation of projects we provide the highest quality IT Services.

Who Should Apply

Candidates who have difficulty finding jobs even after completing their bachelors and masters.

Candidates who are working on redundant technologies and want to become relevant again to boost their growth.

Candidates who want to enhance their skill portfolio .

After training you will get an opportunity to work with companies like Apple, Google, Wells Fargo, Client, PayPal, eBay etc.*

Required Qualifications

Bachelors or Masters in Computer Science/MIS/IT/Mathematics/Statistics etc.

Skills Required

Basic knowledge of C, C++,Core Java,Python etc.

Benefit's Of Working With Our Clients

E-Verified.
Filing of H1b and Green Card.
On Job Technical Support.
Certifications on Advance java**

Interested candidates please send a word or PDF copy of your resume at Email Id: vishal@synergisticit.com or call at 510-347-8238 (Vishal).",USA,LA,Morgan City
RIOS Intelligent Machines,Machine Learning and Robotics Software Engineer,Machine Learning,https://www.linkedin.com/jobs/view/3434704288/?alternateChannel=search&refId=Ki28%2FaJ2wqbGNBRi7UeOlg%3D%3D&trackingId=Mfiq3WUlgTUgn9RxZvcnBw%3D%3D&trk=d_flagship3_search_srp_jobs,"Menlo Park, CA",Pelny etat,Poczatkujacy,"About RIOS

RIOS Intelligent Machines, Inc. (""RIOS"") is a technology company helping enterprises automate their entire factories, warehouses, or supply chain operations – by deploying AI-powered end-to-end robotic workcells that integrate within existing workflows. RIOS is the leader of fullstack AI-powered robotic workcells for factory automation and deploys its robotic fleet at scale to transform labor-intensive factories into ""lights-out"" factories of the future powered by robotics and AI. RIOS was founded by former Xerox PARC engineers and is headquartered in Menlo Park, CA. More information is available at www.rios.ai.

RIOS is looking for a Machine Learning and Robotics Software Engineer who can transform prototype machine learning models into robust products running reliably in the field to revolutionize manufacturing, supply chains, e-commerce, and other industrial applications.

Responsibilities of the role include:
Understand application space and system performance requirements by communicating with ML and application engineers
Design, build and deploy the inference systems and code for our ML products in the field
Write versatile ROS nodes performing inference on robotic systems, that can be configured easily by application engineers depending on their needs
Improve the performance and speed of our ML inference pipelines
Debug and fix deployed systems when issues arise
Continuous integration/development driven development for both codebases and model performance

Technical attributes of candidates may include:
3 years industry experience (likely with M.S. or Ph.D. in Computer Science, Data Science, Machine Learning, or related field)
Familiarity with State-of-the-Art algorithms and real world performance on GPUs
High degree of familiarity with ML/DL frameworks: TensorFlow, PyTorch, Jax, Keras, MXNet, Scikit Learn, etc.
Attention to details such as documentation, version control and reproducibility
Advanced proficiency working with Python (C++ a plus)
Good understanding of ROS and experience building nodes for ROS systems

Nice to Have:
Specialization in applications including computer vision, robotic control

Perks
Competitive salary package & Stock options for every employee
Healthcare + dental + vision insurance plans
401(k) plan
Free lunch on-site at headquarters
Flexible time off & paid holidays
Social events + happy hours + team parties

Salary range: $100K-$180K depending on job title, education, and experience.
No search firm submissions at this time.",USA,CA,Menlo Park
Harnham,Machine Learning Engineer,Machine Learning,https://www.linkedin.com/jobs/view/3435342745/?alternateChannel=search&refId=jNJAqEKojJACVLTj2uEkQg%3D%3D&trackingId=wsjPYlubkcH2LPJVSRNy2A%3D%3D&trk=d_flagship3_search_srp_jobs,"Londyn, Anglia, Wielka Brytania",Pelny etat,Poczatkujacy,"The Company

Harnham are working with an AI start-up who have built a fantastic new product for the financial services space.

Highlights Of Their Journey So Far
They spun out of a top London university
Won a prestigious Microsoft Venture Fund Award
Have received investment from some of Europe's leading investors
THE ROLE

You Will

Work alongside a team of Data Scientists to optimize, improve and deploy machine learning models

Experiment with deep learning and run tests and experiments

Lead coding and engineering best practice

Work with state-of-the-art technologies (Spark, Tensorflow, Keras)

You Must Have

YOUR SKILLS AND EXPERIENCE

An MSc or Ph.D. in Computer Science, Machine Learning, Artificial Intelligence or Mathematics

1-2 years experience in a machine learning engineering role

Experience with Python (pandas, numpy, scikit learn, tensorflow, keras), Unix, github

The Benefits

£80,000 + benefits

How To Apply

Please register your interest by sending your CV via the Apply link on this page. For more information about similar data science roles at Harnham please contact Graham Kinsey at Harnham.",Wielka Brytania,Anglia,Londyn
CareerAddict,Machine Learning Engineer,Machine Learning,https://www.linkedin.com/jobs/view/3430778376/?alternateChannel=search&refId=gQw7tjoVX68Ij3wlR2A%2BwA%3D%3D&trackingId=YEtdSVVCqVBxUu1%2BeWDszA%3D%3D&trk=d_flagship3_search_srp_jobs,"Basingstoke, Anglia, Wielka Brytania",Zlecenie,Poczatkujacy,"Job Title: Machine Learning Engineer

Location: Hampshire

Contract: 6 months+

Rate: £550 per day inside ir35

Your Role

DV security clearance is required for this role

I am looking for a Machine Learning Engineer on behalf of a client of mine who are a leading IT Systems Integrator operating within the UK defence sector. You will look to be included in a mixture of research, development, and deployment activities, covering state-of-the-art machine learning models on several use cases.

Your Skills

Design machine learning systems
Research and implement appropriate ML algorithms and tools
Develop machine learning applications according to requirements
Select appropriate datasets and data representation methods
Run machine learning tests and experiments
Perform statistical analysis and fine-tuning using test results
Train and retrain systems when necessary
Extend existing ML libraries and frameworks
Keep abreast of developments in the field

Your Experience

Proven experience as a Machine Learning Engineer or similar role
Understanding of data structures, Datamodelling and software architecture
Deep knowledge of math, probability, statistics and algorithms
Ability to write robust code in Python, Java and R
Familiarity with machine learning frameworks (like Keras or PyTorch) and libraries (like scikit-learn)
Outstanding analytical and problem-solving skills
BSc in Computer Science, Mathematics or similar field; Master's degree is a plus

If you are interested in this role or wish to apply, please feel free to reply to this advert or call me.

Kind Regards,",Wielka Brytania,Anglia,Basingstoke
CareerAddict,Machine Learning Engineer,Machine Learning,https://www.linkedin.com/jobs/view/3429637862/?alternateChannel=search&refId=gQw7tjoVX68Ij3wlR2A%2BwA%3D%3D&trackingId=NNpW89RxfcboLXADYXozOw%3D%3D&trk=d_flagship3_search_srp_jobs,"East Sussex, Anglia, Wielka Brytania",Pelny etat,Poczatkujacy,"Machine Learning Engineer - £60-80k + Benefits

Hays Intelligent Automation are working with a global technology leader that provides bespoke solutions in Earth & Data Science space.

They are looking to hire a number of Machine Learning Engineer's to play a vital role in the continual development of their geoscience capabilities.

The successful Machine Learning Engineers will work closely with researchers, software developers and scientists in the geoscience teams to help implement Machine Learning and Deep Learning solutions.

As a Machine Learning Engineer, you will also be responsible for managing potential opportunities for machine learning techniques, prepare data for training and testing, designing models, training the model and deploying in production.

To be considered for this role, the successful Machine Learning Engineer will need:

A passion for programming and technology
A good understanding and knowledge of C/C++ & python
A keen interest in analytical and problem-solving challenges
Experience with Deep learning neural network building
Experience of Deep learning frameworks
The ability to define and manage project deadlines
Organisational skills to balance workloads across a wide variety of projects
The confidence to work with and keep stakeholders regularly informed on progress

The organisation is going through an exciting period of growth, if you would like to know more please apply direct and one of the Intelligent Automation team will be in touch.

Hays Specialist Recruitment Limited acts as an employment agency for permanent recruitment and employment business for the supply of temporary workers. By applying for this job you accept the T&C's, Privacy Policy and Disclaimers which can be found on our website.",Wielka Brytania,Anglia,East Sussex
Harnham,Machine Learning Engineer,Machine Learning,https://www.linkedin.com/jobs/view/3420408611/?alternateChannel=search&refId=FBiGaKDEGuo2XRHYev3aWw%3D%3D&trackingId=WvkR3GZ2pK22MISFU%2Bm26g%3D%3D&trk=d_flagship3_search_srp_jobs,"Londyn, Anglia, Wielka Brytania",Pelny etat,Poczatkujacy,"London

£60,000

The Company

Harnham is working with a household name in the entertainment industry. This organization has been around for well over 40 years and

have a unique model. They have also worked with over 300 entities across the country every year.

THE ROLE

You Will

Be expected to build and maintain the infrastructure required for optimal extraction.

Develop auto-ML infrastructure for model selection and hyper-parameter tuning

Lead coding and engineering best practice

Work with state-of-the-art technologies (Bash, SQL, Keras)

You Must Have

YOUR SKILLS AND EXPERIENCE

An MSc or Ph.D. in Computer Science, Machine Learning, Artificial Intelligence, or Mathematics

1-2 years experience in a machine learning engineering role

Experience with Python (pandas, numpy, scikit learn, tensorflow, keras), Unix, github

The Benefits

£60,000 + benefits

How To Apply

Please register your interest by sending your CV via the Apply link on this page. For more information about similar data science roles at Harnham please contact Graham Kinsey at Harnham.",Wielka Brytania,Anglia,Londyn
Harnham,Machine Learning Engineer,Machine Learning,https://www.linkedin.com/jobs/view/3433048122/?alternateChannel=search&refId=FBiGaKDEGuo2XRHYev3aWw%3D%3D&trackingId=q56XZwqsO96%2FRjVwCQdEQg%3D%3D&trk=d_flagship3_search_srp_jobs,"Londyn, Anglia, Wielka Brytania",Pelny etat,Poczatkujacy,"London/Oxfordshire

£75,000 - £95,000

This is an exciting new opportunity for a Data Science expert to join a growing start-up.

The Company

This tech start-up are focused on using machine learning and engineering to make a positive social impact working on cases in the healthcare space, renewable energy space and more. You'll be in a small but specialist team, working on a range of projects around simulation. They have two offices in the UK and are looking to expand overseas as the company grows so it's a great time to join.

THE ROLE

As An ML Engineer For The Business You Will
Act as a technical lead, spending half your time liaising with clients and managing projects.
Working with 3D data, building deep learning models (CNN's, transformers, graphical neural networks) in order to improve how simulations work
Be responsible for deploying models onto the cloud
Skills And Experience
Degree in a numerical or relevant field is preferred
Deep Learning experience is essential
Experience deploying machine learning models is essential
Simulation / Engineering experience is essential
Leadership experience would be beneficial
Tech: Python, SQL, Cloud technologies, Docker, Kubernetes
Salary And Benefits
Basic Salary £75,000 - £95,000
Benefits Package
Flexible Working
How To Apply

Please register your interest for this role by sending your CV to Rosie O'Callaghan via the apply link on this page",Wielka Brytania,Anglia,Londyn
Jobs via eFinancialCareers,Machine Learning Engineer - FinTech,Machine Learning,https://www.linkedin.com/jobs/view/3422125647/?alternateChannel=search&refId=FBiGaKDEGuo2XRHYev3aWw%3D%3D&trackingId=MJKBO96%2FEIKCzdGBCamWZA%3D%3D&trk=d_flagship3_search_srp_jobs,"Londyn, Anglia, Wielka Brytania",Pelny etat,Poczatkujacy,"The role will require you to utilise your skills in python and machine learning.The role is focused on scraping data from PDF files and provide exception handling techniques to provide greater insights and advance their capabilities. They are cloud hosted on AWS and work in a serverless environment through lambdas. The ideal candidate would have a background in software engineering and have fintech experience, but it is not essential.

This is a hybrid role requires you to come to a London based office (Victoria), 2 days a week.",Wielka Brytania,Anglia,Londyn
CareerAddict,Machine Learning Engineer - Perm,Machine Learning,https://www.linkedin.com/jobs/view/3429054457/?alternateChannel=search&refId=FBiGaKDEGuo2XRHYev3aWw%3D%3D&trackingId=Kugv0Pq0bk5oT%2B%2Bdutoqnw%3D%3D&trk=d_flagship3_search_srp_jobs,"Basingstoke, Anglia, Wielka Brytania",Pelny etat,Poczatkujacy,"Job Title: Machine Learning Engineer

Location: Basingstoke (Largely remote at the moment with occasional meetings in Basingstoke or London)

Clearance: Must have an active SC OR DV

Salary: Competitive

This is an excellent opportunity for a Machine Learning Engineer to build on their professional and academic experience with a large defence client.

This client have heavily invested in their machine learning function and team members will be able to operate with bleeding edge technology.

An individual with practical experience, professionally or personally of Machine Learning operations will thrive in this environment.

Roles & Responsibilities

Design machine learning systems
Research and implement appropriate ML algorithms and tools
Develop machine learning applications according to requirements
Select appropriate datasets and data representation methods
Run machine learning tests and experiments
Perform statistical analysis and fine-tuning using test results
Train and retrain systems when necessary
Extend existing ML libraries and frameworks
Keep abreast of developments in the field

Skills

Proven experience as a Machine Learning Engineer or similar role
Understanding of data structures, Datamodelling and software architecture
Deep knowledge of math, probability, statistics and algorithms
Ability to write robust code in Python, Java and R
Familiarity with machine learning frameworks (like Keras or PyTorch) and libraries (like scikit-learn)
Excellent communication skills
Ability to work in a team
Outstanding analytical and problem-solving skills
BSc in Computer Science, Mathematics or similar field; Master's degree is a plus

If you're interested in the above and would like an informal conversation, don't hesitate to reach out!

(see below)",Wielka Brytania,Anglia,Basingstoke
