Company Name,Title,Role,Role url,Localisation,Type,Level,Description,Country,Region,City
CBSbutler c/o Staffing 360 Solutions Limited,Machine Learning Engineer,Machine Learning,https://www.linkedin.com/jobs/view/3435284759/?alternateChannel=search&refId=TB8QvLo2SPYfhwJGSOy59Q%3D%3D&trackingId=FSbEhFPSOmZAcrFKzGg3xw%3D%3D&trk=d_flagship3_search_srp_jobs,"Hampshire, Anglia, Wielka Brytania",Pelny etat,Poczatkujacy,"Ta oferta została pozyskana z tablicy ofert pracy. Więcej informacji
Job Title: Machine Learning Engineer
Location: Hampshire Contract: 6 months+ Rate: £550 per day inside ir35 DV security clearance is required for this role Your role: I am looking for a Machine Learning Engineer on behalf of a client of mine who are a leading IT Systems Integrator operating within the UK defence sector. You will look to be included in a mixture of research, development, and deployment activities, covering state-of-the-art machine learning models on several use cases. Your Skills:-Design machine learning systems
Research and implement appropriate ML algorithms and tools
Develop machine learning applications according to requirements
Select appropriate datasets and data representation methods
Run machine learning tests and experiments
Perform statistical analysis and fine-tuning using test results
Train and retrain systems when necessary
Extend existing ML libraries and frameworks
Keep abreast of developments in the field Your experience:
Proven experience as a Machine Learning Engineer or similar role
Understanding of data structures, data modelling and software architecture
Deep knowledge of math, probability, statistics and algorithms
Ability to write robust code in Python, Java and R
Familiarity with machine learning frameworks (like Keras or PyTorch) and libraries (like scikit-learn)
Outstanding analytical and problem-solving skills
BSc in Computer Science, Mathematics or similar field; Master's degree is a plus If you are interested in this role or wish to apply, please feel free to reply to this advert or call me on (phone number removed) or (phone number removed) Kind Regards",Wielka Brytania,Anglia,Hampshire
Lundy Group - Lundy Management Group,"Junior Machine Learning Engineer - Finance - Python, R, Spark",Machine Learning,https://www.linkedin.com/jobs/view/3425221263/?alternateChannel=search&refId=Qx1CZ1RF52Mby1nRIYC5yA%3D%3D&trackingId=HbBelL7u9jkbvzU%2FmL1NBQ%3D%3D&trk=d_flagship3_search_srp_jobs,"Londyn, Anglia, Wielka Brytania",Pelny etat,Poczatkujacy,"Ta oferta została pozyskana z tablicy ofert pracy. Więcej informacji
Junior Machine Learning Engineer Finance Python, R, Spark

Machine learning engineer with a passion for pushing the boundaries of technology is required to join the Emerging Technologies team of a large blue chip. You will be working on exciting forward thinking projects, helping clients utilise cutting edge technologies to find process improvements, lower their carbon emissions, or lower costs.

Key Skills
Experience in machine learning, statistical modelling, quantitative analysis, Forecasting, data visualization, recommendation engine etc.
2+ years professional experience in software development in languages like Python, R, Spark & SQL. Experience in Tensor flow, keras, transformers, Sci-kit learn, python libraries
Experience in design/implementation/consulting experience training ML models & deploying scoring pipelines at scale.
Experience in web development technologies like java/node.js/C#
Understanding of Data warehousing tool & Power BI.
Responsibilities
Design, execution, & measurement of data initiatives across customer-facing engagements requiring advanced automation scenarios.
Applying data Science, ML algorithms, using standard statistical tools & techniques for solving client business problems.
Working on advanced automation client use cases.
Work in Machine Learning, Statistical Modelling, Quantitative Analysis, Forecasting, Data Visualization, recommendation engine.
Work in design/implementation/consulting of ML models & deploying scoring pipelines at scale. Integrate this with Automation technologies.
Understanding of Azure ML Studio, Azure Databricks, IBM Watson Studio etc will be required",Wielka Brytania,Anglia,Londyn
WovenLight,Machine Learning Engineer (Principal),Machine Learning,https://www.linkedin.com/jobs/view/3398118412/?alternateChannel=search&refId=a173bnLmVpEMJZLiSJU14w%3D%3D&trackingId=XXNVZzzA05jz0t%2FfUCtaNw%3D%3D&trk=d_flagship3_search_srp_jobs,"Londyn, Anglia, Wielka Brytania",Pelny etat,Poczatkujacy,"WovenLight's vision is to inject data and analytics into both the core of value creation at portfolio companies, and how we ourselves operate as an investment firm. To execute our mission we are building an integrated team of world class investment, operating and technology professionals. If you are excited about working with us to build the next generation private equity firm we would love to hear from you.

As a Principal Machine Learning Engineer, you will lead the development of technical solutions that help WovenLight create value across its portfolio. You will play a key role on individual projects for portfolio companies, as well as contributing to investment tools that underpin our approach across the investment lifecycle.

You will lead teams through the design, development and deployment of machine learning systems into production, being responsible for architecture, code quality and engineering design. You will balance hands-on work with team leadership responsibilities depending on the context of the specific project.

Examples of projects you could work on include:

Optimisation modelling to improve manufacturing throughput
Predictive modelling to anticipate/avoid asset downtime
Predicting and reducing customer churn
Identifying next best action for sales agents
Geospatial modelling to improve store footprint

Our internal investment tools use multiple data sources and ML algorithms to help our investment team improve the sourcing and selection of new portfolio companies.

You will work on these projects in integrated teams of technical and business-facing colleagues, while also collaborating with our investment team. You will apply a combination of leadership skills and deep technical expertise in data, infrastructure, ML algorithms and software engineering to deliver high quality technical solutions. You will also be involved to the alignment of scope, distribution of tasks, estimation of timelines and tracking of progress across the lifetime of the projects.

You will act as line manager for more junior WovenLight engineers, being responsible for coaching and mentoring them. You will also support our portfolio companies as they build and scale their ML teams internally. You should be comfortable giving and receiving feedback, as well as helping set personal development objectives.

The successful candidate should have the following attributes:

Passion and expertise in developing, deploying and monitoring ML algorithms to deliver commercial impact – ideally 6+ years of experience
Experience coaching and managing engineers
Excellent communication skills - able to explain complex analytical concepts to people from other fields
Expertise in Python and a deep knowledge of the Python ML stack (e.g. numpy, pandas, scikit-learn, pytorch / tensorflow))
Experience in the full development lifecycle of APIs, containerised (micro-)services, SDKs, and CLIs
Experience with one or more of the following tools & technologies:
Cloud platforms such as AWS, Azure or GCP
Data pipelining frameworks (e.g. Airflow, Kedro),
MLOps platforms (e.g. Databricks, Kubeflow, GCP Vertex)
Databases and data processing languages & tools, e.g. SQL (py-)Spark

Our core team is based in London. Interviews for this role will be conducted via a combination of phone, video-conference and in person.

WovenLight is committed to equal employment opportunity regardless of sex, race, religion, ethnicity, nationality, disability, age, sexual orientation, gender identity or any other basis as protected by applicable law.",Wielka Brytania,Anglia,Londyn
ersg Ltd,Machine Learning Expert,Machine Learning,https://www.linkedin.com/jobs/view/3429370713/?alternateChannel=search&refId=wT00VfAoqaTVZ2Y1KCb3aQ%3D%3D&trackingId=2OghTIKXvJDiZ7yhCFUTNQ%3D%3D&trk=d_flagship3_search_srp_jobs,"Londyn, Anglia, Wielka Brytania",Pelny etat,Poczatkujacy,"Ta oferta została pozyskana z tablicy ofert pracy. Więcej informacji
Machine Learning Expert We are looking for a Machine Learning Expert to support Advanced Digital Solutions for Public Services. This position will be fully remote. The candidate must be available between 9:00 AM and 14:00 h UTC+2). We are looking for someone full time between 37 y 40 hours per week.

The core skills we are looking for are: Programming languages including Bash, Python and SQL Knowledge of Python and ML standard libraries (GeoPandas, GDAL, rasterio, TensorFlow, SciPy, etc…) Experience with Spark, Databriks, Dremio Knowledge and experience in Azure architectures Agile methodologies, CI/CD techniques, Git Experience with spatial and spatiotemporal data is a plusThis position is deemed Outside IR35.

ersg are an equal opportunities employer; we are committed to promoting equality of opportunity for all job applicants. We do not discriminate against applicants on the basis of age, sex, race, disability, pregnancy, marital status, sexual orientation, gender reassignment or religious background; all decisions are based on merit",Wielka Brytania,Anglia,Londyn
Iron Mountain,Machine Learning Engineer,Machine Learning,https://www.linkedin.com/jobs/view/3428491157/?alternateChannel=search&refId=WxwSo2xXjr5cqePC2sJD2A%3D%3D&trackingId=pq2%2FMeeQ3Be%2FTHMA0hUKXg%3D%3D&trk=d_flagship3_search_srp_jobs,Polska,Pelny etat,Poczatkujacy,"At Iron Mountain we protect what our customers value most, from the everyday to the extraordinary. We build customer value around the world with a passion for preserving the physical, transforming the digital, and respecting the environmental. We pioneered the industry for global records and information management and have established some of the best customer relationships in the industry with 95% of the Fortune 1000 companies among our 225,000 loyal customers. Here, you’ll bring your expertise and creativity to a workplace that thrives on continuous improvement. Here, you’ll be part of a global workforce that embraces the differences among us. And here, we’ll encourage you to Climb Higher for the benefit of our customers and each other. There is so much more, but enough about us. We can’t wait to hear about YOU.

Job Summary:

Iron Mountain InSight is a cutting-edge AI enablement platform that applies industry leading Machine Learning (ML) technology to classify and extract entities from unstructured content (Document Images, Audio and Video files, other data files and sources).

The ML engineer works closely with multiple internal Iron Mountain teams to develop and deliver quality ML solutions, create/enhance ML tools for performance improvement.

Essential Job Responsibilities:

Design and development of ML models to perform classification and entity extraction of various forms of digital content (Images, Audio/video, and other digital file formats).
Work with project managers, solution architects and other engineers to build and deploy ML solutions into Iron Mountain Insight Platform.
Perform feasibility analysis and deliver PoC (Proof of Concept) for various customer requirements.
Applying effective visualization tools to make analysis and results intuitive and informative to the team and customers.
Participating in R & D to build Iron Mountain IP (Intellectual Property).
Work closely with the business to identify issues and use data to propose solutions for effective decision-making.

Functional Knowledge Skills & Competencies:

Education: Master/Bachelor/PhD degree in Computer Engineering, Computer Science or related discipline

Skills:

Deep understanding on Machine Learning and AI techniques.
Professional experience in Python programming.
Deep understanding of Cloud Technologies and solutions - GCP Preferred.
Strong technical background and understanding of enterprise solutions
Proven internal/external written and verbal communication, interpersonal and analytical skills
Ability to multitask and prioritize issues in a complex environment.
ML-related publication preferred.
Experience working in an Agile environment
Good team player

\

Category: gja\Information Technology

Iron Mountain Incorporated, founded in 1951, is the global leader for storage and information management services. Trusted by more than 225,000 organizations around the world in approximately 50 countries, Iron Mountain stores and protects billions of valued assets, including critical business information, highly sensitive data, and cultural and historical artifacts.

Providing solutions that include information management, digital transformation, secure storage, secure destruction, as well as data centers, cloud services, and art storage and logistics, Iron Mountain helps customers lower cost and risk, comply with regulations, recover from disaster, and enable a digital way of working.

Our Cores Values and Code of Ethics are our north star. They provide a solid base for how we do business and behave every day, so each one of us can experience exceptional.

If you have a physical or mental disability that requires special accommodations, please let us know by sending an email to accommodationrequest@ironmountain.com. See the Supplement to learn more about Equal Employment Opportunity.

Iron Mountain is committed to a policy of equal employment opportunity. We recruit and hire applicants without regard to race, color, religion, sex (including pregnancy), national origin, disability, age, sexual orientation, veteran status, genetic information, gender identity, gender expression, or any other factor prohibited by law.

To view the Equal Employment Opportunity is the Law posters and the supplement, as well as the Pay Transparency Policy Statement, CLICK HERE

Requisition: J0053061",Polska,,
Volven,Machine Learning Engineer,Machine Learning,https://www.linkedin.com/jobs/view/3422638073/?alternateChannel=search&refId=hwbGo%2FeJLj7I0nms%2FOoX9w%3D%3D&trackingId=sgz0nzA5Aj91DubYZUcpPw%3D%3D&trk=d_flagship3_search_srp_jobs,"Warszawa, Woj. Mazowieckie, Polska",Pelny etat,Poczatkujacy,"We are looking for Machine Learning Engineer to work for a European company from the fintech industry specializing in algorithmic trading and cryptocurrencies. You will be working in a small but talented team to evolve and improve our product. Getting started: ASAP We offer:

attractive salary depending on skills and experience (B2B: PLN 25000-35000 net/month)
bonus paid for work efficiency and commitment
Tools used:

Collaboration: Teams, Jira, Confluence
Source repositories: GitHub
Software development automation: Make
Databases: MySQL, in-house time-series database
Monitoring: Prometheus, Grafana
Containers: Docker, Kubernetes
Cloud services: AWS (mostly EKS, ECR, EC2, EFS, RDS but we adapt more and more cloud services to our stack)
Organization of work:

Agile development: TDD, DevOps, CI/CD
Good practices: clean code, design patterns
Quality assurance: code review, pair programming
Tests: unit / integration / performance / manual
Tasks/Responsibilities:

Building a core Machine Learning functionality for the most innovative trading application in the world.
Designing and implementing and tuning machine learning models, which optimize trading algorithms and support market prediction.
Processing and analysing both historical and real-time stock data.
Scaling out current systems to support bigger traffic and huge amounts of data.
Create easy-to-read, fast and well-architected, quality code for the constant improvement of our Machine Learning services.
Reviews other’s code and designs and provides constructive feedback to meet our high-quality standards.
Participating in gathering business requirements and translating them to the language of Artificial Intelligence.
Requirements:

Higher education - IT or related.
Min. 1 year of experience working with Artificial Intelligence.
Min. 1 year of experience working with Python.
Knowledge of the PyTorch library (or similar).
Acquaintance with tools and concepts used in modern Machine Learning development (VCS, IDE of choice, Python libraries, microservices, containerization etc.).
Very good interpersonal skills and ability to communicate in English (at least B2 level).
Strong Computer Science fundamentals in Data Structures, Algorithms, Complexity Analysis, Object-Oriented Design and Designing Large Scale Data-Intensive Applications.
Excellent Analytical and Communication skills including experience speaking to technical and business audiences and working globally.

Good To Have

knowledge of Kubernetes, AWS, CI/CD Pipeline or willing to learn them
knowledge in the field of finance, trading systems, cryptocurrencies, financial markets
Highly welcome: activity and interest in the field of ML (competitions, conferences, publications, projects).
Benefits:

private medical care
multisport card
co-financing of trainings and courses
possibility to work remotely or in coworking space nearby you
flexible working hours
integration meetings
employee recommendation program
free coffee/tea/fruit in the office
If you are interested, please send your CV in English",Polska,Woj. Mazowieckie,Warszawa
Evolution,Machine Learning Engineer / Product Data and Back Office,Machine Learning,https://www.linkedin.com/jobs/view/3433726718/?alternateChannel=search&refId=hwbGo%2FeJLj7I0nms%2FOoX9w%3D%3D&trackingId=5VEF8wisYE3FBPSa73FhqA%3D%3D&trk=d_flagship3_search_srp_jobs,"Warszawa, Woj. Mazowieckie, Polska",Pelny etat,Poczatkujacy,"Job Description

We are searching for a passionate Machine Learning engineer/ software developer to join our Data Science team.

Qualifications

Main Duties & Responsibilities:

Design, build and maintain applications, pipelines and workflows for our data science use-cases;
Work closely with data scientists to bring prototype ML models to production;
Work with other teams to provide data and build cloud infrastructure for our ML solutions;
Take part in ML model maintenance, retraining and quality monitoring;
Work with business and technical stakeholders to select and design data science solutions;
Continuous learning about state-of-the-art technologies and practices in the data science and engineering domain.

Qualifications:

University degree in numerical field (Computer science, Machine Learning, Mathematics, Physics, Engineering, etc.);
Experience as software developer with at least one of the languages: Python, Scala, Java;
Experience with SQL and Big data processing frameworks such as Spark or Flink;
Experience with at least one ML framework and knowledge in at least one Machine Learning field such as regression, classification, clustering, optimisation, statistics.
Experience bringing a machine learning solution to production;
Experience with AWS or other cloud provider;
Highly proficient in spoken and written English;
Excellent communication skills and a pragmatic approach to problem-solving;
Willingness to learn and interest in the latest trends in programming and machine learning.

Nice to Have:

Experience with MLOps;
Knowledge of Scala and interest in functional programming highly appreciated;
Experience with Kafka, Clickhouse, Postgres, Kubernetes, Docker.

Additional Information

We offer:

Challenging work with the award-winning products in a dynamic international team;
Health insurance;
Professional and personal development;
Opportunities to progress within the company.

About Us

Evolution is a market-leading developer and provider of products and services for online casino entertainment. Our excellence is driven by over 16,000 EVOlutioneers across 30 markets worldwide, working in product innovation, software development, IT solutions, game hosting and business support. Evolution's dynamic and creative environment creates a unique opportunity for personal and professional growth.

Our integrated business-to-business solutions guarantee that our clients can always provide an unrivalled online entertainment experience to their players globally. We thrive on remaining an award-winning digital powerhouse of entertainment products and services with an ever-expanding line-up of product brands: Evolution Live, NetEnt, Red Tiger, Ezugi, Big Time Gaming, Nolimit City and DigiWheel.

Evolution is a Swedish company founded in 2006 and listed on Nasdaq Nordic (EVO).

Apply now

You're almost there!

We look forward to receiving your application. This will only take a minute to complete.

Upload CV

Connect with LinkedIn

Fill manually

Please read our Applicant Privacy Notice before submitting your application and note that by submitting your application, you accept our privacy policy and cookie policy as well as the privacy policy and terms of use of SmartRecruters, the platform we use for administrating CVs.",Polska,Woj. Mazowieckie,Warszawa
Turing,Remote Machine Learning Developer Jobs,Machine Learning,https://www.linkedin.com/jobs/view/3415403753/?alternateChannel=search&refId=dF9BZlIYlkIVgNy0nNxrCw%3D%3D&trackingId=YQY295DzReGLf3B9W65YCA%3D%3D&trk=d_flagship3_search_srp_jobs,Polska,Pelny etat,Poczatkujacy,"An AI-automated platform is looking for a RoR deloper. The selected candidate will collaborate with dedicated engineers and developers to deliver technology through web and mobile applications. The candidate will work on a product that will help students understand the material they are studying by using technology to surface relevant, machine-curated explanations. The company aims to help anyone learn anything by using proprietary algorithms that can summarize and curate sets of flashcards on any textbook in the world. This is a great opportunity for those who want to work with a tech-savvy and rapidly growing startup.

Job Responsibilities:

Work with the founding team developing new features
Improve as well as optimize the current codebase
Support product development and suggest an improvement
Build high-performance applications",Polska,,
Quickchat AI,Machine Learning Engineer,Machine Learning,https://www.linkedin.com/jobs/view/3426767480/?alternateChannel=search&refId=%2BmO8GCTF%2B0Gfv5%2BbVqDrkg%3D%3D&trackingId=w9YNLiMr5JJrZDpIgcRIfQ%3D%3D&trk=d_flagship3_search_srp_jobs,"Warszawa, Woj. Mazowieckie, Polska",Pelny etat,Poczatkujacy,"Join our Technology team to build consumer products and business solutions on top of state of the art language models like OpenAI’s GPT-3. From day one, you will take ownership and contribute to key parts of our technology.

We live and breathe Machine Learning. We love Python, Linux and Git. We tolerate JavaScript, CSS, even React Native at times.

Requirements
1+ years in Software Engineer or ML Engineer roles
deep understanding of Machine Learning theory and practice
technical fluency in English
great communication skills
Bonus Points For
Kaggle competitions (walk me through your solution!)
interesting side projects (we will want to ask a lot of questions about them!)
deeply technical interests other than software / Machine Learning
currently live coding projects (we will want to have a look at them before your interview)
teaching us something we didn’t know before about our product / industry
ever having written AWK scripts
experience with Django, single-page applications, Nginx, cloud computing, API design
experience deploying apps to the App Store or Google Play
deep understanding of and experience working with GPT-3 and other language models
experience training ML models for time-series data
experience training classification models for extremely imbalanced classes
reading machine learning papers in your spare time (share your favourites!)
telling us about something that’s wrong with our product along with a concrete and detailed plan on how you would try to improve it
deep first-principles understanding of some computing process, e.g. what exactly happens when you type a URL and press enter, exactly how blockchain / a neural network / a chess-playing algorithm / Google’s Ad bidding / Shazam’s song search works (we will definitely want you to tell us all about it!)
a story about your ML model that worked great on historical data and failed in production
a story about how you spent hours labelling data by hand for your ML model
a story about how you spent 3 days debugging something and finally found a solution
a story about how you had no idea how your users were using your product until you started measuring it
expertise in middle-out compression",Polska,Woj. Mazowieckie,Warszawa
